id,imdb_id,genres,original_language,original_title,overview,popularity,title,vote_average,vote_count,weighted_rating
16869,tt0361748,"Drama, Action, Thriller, War",en,Inglourious Basterds,"In Nazi-occupied France during World War II, a group of Jewish-American soldiers known as ""The Basterds"" are chosen specifically to spread fear throughout the Third Reich by scalping and brutally killing Nazis. The Basterds, lead by Lt. Aldo Raine soon cross paths with a French-Jewish teenage girl who runs a movie theater in Paris which is targeted by the soldiers.",16.89564,Inglourious Basterds,7.9,6598.0,7.740238070539419
17431,tt1182345,"Science Fiction, Drama",en,Moon,"With only three weeks left in his three year contract, Sam Bell is getting anxious to finally return to Earth. He is the only occupant of a Moon-based manufacturing facility along with his computer and assistant, GERTY. When he has an accident however, he wakens to find that he is not alone.",13.336773,Moon,7.6,1831.0,7.295115789473684
2080,tt0458525,"Adventure, Action, Thriller, Science Fiction",en,X-Men Origins: Wolverine,"After seeking to live a normal life, Logan sets out to avenge the death of his girlfriend by undergoing the mutant Weapon X program and becoming Wolverine.",1.456541,X-Men Origins: Wolverine,6.2,4086.0,6.327253076923077
13475,tt0796366,"Science Fiction, Action, Adventure",en,Star Trek,"The fate of the galaxy rests in the hands of bitter rivals. One, James Kirk, is a delinquent, thrill-seeking Iowa farm boy. The other, Spock, a Vulcan, was raised in a logic-based society that rejects all emotion. As fiery instinct clashes with calm reason, their unlikely but powerful partnership is the only thing capable of leading their crew through unimaginable danger, boldly going where no one has gone before. The human adventure has begun again.",15.362632,Star Trek,7.4,4574.0,7.281314345991561
13448,tt0808151,"Thriller, Mystery",en,Angels & Demons,"Harvard symbologist Robert Langdon investigates a mysterious symbol seared into the chest of a murdered physicist. He discovers evidence of the unimaginable, the rebirth of an ancient secret brotherhood known as the Illuminati, the most powerful underground organization ever to walk the earth.",22.211558,Angels & Demons,6.5,2183.0,6.599337579617834
534,tt0438488,"Action, Science Fiction, Thriller",en,Terminator Salvation,"All grown up in post-apocalyptic 2018, John Connor must lead the resistance of humans against the increasingly dominating militaristic robots. But when Marcus Wright appears, his existence confuses the mission as Connor tries to determine whether Wright has come from the future or the past -- and whether he's friend or foe.",16.507496,Terminator Salvation,5.9,2496.0,6.17587700831025
18360,tt1078912,"Adventure, Fantasy, Action, Comedy, Family",en,Night at the Museum: Battle of the Smithsonian,"Hapless museum night watchman Larry Daley must help his living, breathing exhibit friends out of a pickle now that they've been transferred to the archives at the Smithsonian Institution. Larry's (mis)adventures this time include close encounters with Amelia Earhart, Abe Lincoln and Ivan the Terrible.",15.417181,Night at the Museum: Battle of the Smithsonian,5.9,2026.0,6.217170700636942
14160,tt1049413,"Animation, Comedy, Family, Adventure",en,Up,"Carl Fredricksen spent his entire life dreaming of exploring the globe and experiencing life to its fullest. But at age 78, life seems to have passed him by, until a twist of fate (and a persistent 8-year old Wilderness Explorer named Russell) gives him a new lease on life.",19.330884,Up,7.8,7048.0,7.662694927713795
18785,tt1119646,Comedy,en,The Hangover,"When three friends finally come to after a raucous night of bachelor-party revelry, they find a baby in the closet and a tiger in the bathroom. But they can't seem to locate their best friend, Doug – who's supposed to be tying the knot. Launching a frantic search for Doug, the trio perseveres through a nasty hangover to try to make it to the church on time.",23.947351,The Hangover,7.2,6324.0,7.139192793761763
18240,tt1041829,"Comedy, Romance, Drama",en,The Proposal,"When she learns she's in danger of losing her visa status and being deported, overbearing book editor Margaret Tate forces her put-upon assistant, Andrew Paxton, to marry her.",8.058337,The Proposal,6.7,1858.0,6.735234185733513
12162,tt0887912,"Drama, Thriller, War",en,The Hurt Locker,"Forced to play a dangerous game of cat-and-mouse in the chaos of war, an elite Army bomb squad unit must come together in a city where everyone is a potential enemy and every object could be a deadly bomb.",9.403724,The Hurt Locker,7.2,1881.0,7.048986978297162
8373,tt1055369,"Science Fiction, Action, Adventure",en,Transformers: Revenge of the Fallen,"Sam Witwicky leaves the Autobots behind for a normal life. But when his mind is filled with cryptic symbols, the Decepticons target him and he is dragged back into the Transformers' war.",4.351756,Transformers: Revenge of the Fallen,6.0,3192.0,6.2054147700882485
11322,tt1152836,"History, Crime, Drama",en,Public Enemies,"Depression-era bank robber John Dillinger's charm and audacity endear him to much of America's downtrodden public, but he's also a thorn in the side of J. Edgar Hoover and the fledgling FBI. Desperate to capture the elusive outlaw, Hoover makes Dillinger his first Public Enemy Number One and assigns his top agent, Melvin Purvis, the task of bringing him in dead or alive.",10.364794,Public Enemies,6.5,1371.0,6.631797183098591
8355,tt1080016,"Animation, Comedy, Family, Adventure",en,Ice Age: Dawn of the Dinosaurs,"Times are changing for Manny the moody mammoth, Sid the motor mouthed sloth and Diego the crafty saber-toothed tiger. Life heats up for our heroes when they meet some new and none-too-friendly neighbors – the mighty dinosaurs.",12.980624,Ice Age: Dawn of the Dinosaurs,6.5,2330.0,6.59509756097561
19913,tt1022603,"Comedy, Drama, Romance",en,(500) Days of Summer,"Tom (Joseph Gordon-Levitt), greeting-card writer and hopeless romantic, is caught completely off-guard when his girlfriend, Summer (Zooey Deschanel), suddenly dumps him. He reflects on their 500 days together to try to figure out where their love affair went sour, and in doing so, Tom rediscovers his true passions in life.",16.376657,(500) Days of Summer,7.2,2993.0,7.089874847820794
767,tt0417741,"Adventure, Fantasy, Family",en,Harry Potter and the Half-Blood Prince,"As Harry begins his sixth year at Hogwarts, he discovers an old book marked as 'Property of the Half-Blood Prince', and begins to learn more about Lord Voldemort's dark past.",19.083723,Harry Potter and the Half-Blood Prince,7.4,5435.0,7.296918002748512
21208,tt1148204,"Horror, Thriller, Mystery",en,Orphan,"A married couple with a rocky past adopt 9-year old, Esther to fill the void created by a recently-stillborn baby. However, Esther is not quite who she seems.",8.730934,Orphan,6.7,1296.0,6.743450622406639
17654,tt1136608,Science Fiction,en,District 9,"Aliens land in South Africa and, with their ship totally disabled,  have no way home. Years later, after living in a slum and wearing out their welcome the 'Non-Humans' are being moved to a new tent city overseen by Multi-National United (MNU).",11.589835,District 9,7.3,3451.0,7.17652048192771
14869,tt1046173,"Adventure, Action, Thriller, Science Fiction",en,G.I. Joe: The Rise of Cobra,"From the Egyptian desert to deep below the polar ice caps, the elite G.I. JOE team uses the latest in next-generation spy and military equipment to fight the corrupt arms dealer Destro and the growing threat of the mysterious Cobra organization to prevent them from plunging the world into chaos.",11.787058,G.I. Joe: The Rise of Cobra,5.6,1988.0,6.028793036750483
12244,tt0472033,"Action, Adventure, Animation, Science Fiction, Thriller",en,9,"When 9 first comes to life, he finds himself in a post-apocalyptic world. All humans are gone, and it is only by chance that he discovers a small community of others like him taking refuge from fearsome machines that roam the earth intent on their extinction. Despite being the neophyte of the group, 9 convinces the others that hiding will do them no good.",18.502877,9,6.6,1291.0,6.689861122661123
22794,tt0844471,"Animation, Comedy, Family",en,Cloudy with a Chance of Meatballs,"Inventor Flint Lockwood creates a machine that makes clouds rain food, enabling the down-and-out citizens of Chewandswallow to feed themselves. But when the falling food reaches gargantuan proportions, Flint must scramble to avert disaster. Can he regain control of the machine and put an end to the wild weather before the town is destroyed?",11.665693,Cloudy with a Chance of Meatballs,6.5,1799.0,6.6124325437693106
23827,tt1179904,"Horror, Mystery",en,Paranormal Activity,"After a young, middle class couple moves into a suburban 'starter' tract house, they become increasingly disturbed by a presence that may or may not be somehow demonic but is certainly most active in the middle of the night. Especially when they sleep. Or try to.",12.706424,Paranormal Activity,5.9,1351.0,6.304022718052739
19959,tt0986263,"Action, Science Fiction, Thriller",en,Surrogates,"Set in a futuristic world where humans live in isolation and interact through surrogate robots, a cop is forced to leave his home for the first time in years in order to investigate the murders of others' surrogates.",16.211937,Surrogates,5.9,1219.0,6.326882126018003
19908,tt1156398,"Comedy, Horror",en,Zombieland,"Columbus has made a habit of running from what scares him. Tallahassee doesn't have fears. If he did, he'd kick their ever-living ass. In a world overrun by zombies, these two are perfectly evolved survivors. But now, they're about to stare down the most terrifying prospect of all: each other.",11.063029,Zombieland,7.2,3655.0,7.105161669113022
22803,tt1197624,"Drama, Crime, Thriller",en,Law Abiding Citizen,A frustrated man decides to take justice into his own hands after a plea bargain sets one of his family's killers free. He targets not only the killer but also the district attorney and others involved in the deal.,16.639047,Law Abiding Citizen,7.2,1522.0,7.028420333839151
22947,tt1193138,"Drama, Romance",en,Up in the Air,"George Clooney plays the dry cynical character of Ryan Bingham, an executive who specializes in ""downsizing"". Ryan lives out of his suitcase, traveling the country for the sole purpose terminating unwanted employees day after day. Just as Ryan is about to reach his life-long goal of the ten million mile frequent flyer mark some major changes come his way. Changes that threaten to crack the cold heartless exterior that is Ryan Bingham.",8.338562,Up in the Air,6.7,1246.0,6.744371186440677
10315,tt0432283,"Adventure, Animation, Comedy, Family",en,Fantastic Mr. Fox,"The Fantastic Mr. Fox bored with his current life, plans a heist against the three local farmers. The farmers, tired of sharing their chickens with the sly fox, seek revenge against him and his family.",8.695893,Fantastic Mr. Fox,7.5,1206.0,7.1609982758620685
17979,tt1067106,"Animation, Drama",en,A Christmas Carol,"Miser Ebenezer Scrooge is awakened on Christmas Eve by spirits who reveal to him his own miserable existence, what opportunities he wasted in his youth, his current cruelties, and the dire fate that awaits him if he does not change his ways. Scrooge is faced with his own story of growing bitterness and meanness, and must decide what his own future will hold: death or redemption.",12.869273,A Christmas Carol,6.6,1137.0,6.696008884940026
14161,tt1190080,"Action, Adventure, Science Fiction",en,2012,"Dr. Adrian Helmsley, part of a worldwide geophysical team investigating the effect on the earth of radiation from unprecedented solar storms, learns that the earth's core is heating up. He warns U.S. President Thomas Wilson that the crust of the earth is becoming unstable and that without proper preparations for saving a fraction of the world's population, the entire race is doomed. Meanwhile, writer Jackson Curtis stumbles on the same information. While the world's leaders race to build ""arks"" to escape the impending cataclysm, Curtis struggles to find a way to save his family. Meanwhile, volcanic eruptions and earthquakes of unprecedented strength wreak havoc around the world.",16.698628,2012,5.6,4994.0,5.817766208251473
18239,tt1259571,"Adventure, Fantasy, Drama, Romance",en,The Twilight Saga: New Moon,"Forks, Washington resident Bella Swan is reeling from the departure of her vampire love, Edward Cullen, and finds comfort in her friendship with Jacob Black, a werewolf. But before she knows it, she's thrust into a centuries-old conflict, and her desire to be with Edward at any cost leads her to take greater and greater risks.",30.121292,The Twilight Saga: New Moon,5.6,2518.0,5.966221365638766
22881,tt0878804,Drama,en,The Blind Side,"Oversized African-American, Michael Oher, the teen from across the tracks and a broken home, has nowhere to sleep at age 16. Taken in by an affluent Memphis couple, Michael embarks on a remarkable rise to play for the NFL.",12.753109,The Blind Side,7.2,1626.0,7.0349328467153285
22954,tt1057500,"Drama, History",en,Invictus,"Newly elected President Nelson Mandela knows his nation remains racially and economically divided in the wake of apartheid. Believing he can bring his people together through the universal language of sport, Mandela rallies South Africa's rugby team as they make their historic run to the 1995 Rugby World Cup Championship match.",9.109838,Invictus,7.0,1150.0,6.898637809187278
10198,tt0780521,"Romance, Family, Animation, Music",en,The Princess and the Frog,"A waitress, desperate to fulfill her dreams as a restaurant owner, is set on a journey to turn a frog prince back into a human being, but she has to do face the same problem after she kisses him.",16.616517,The Princess and the Frog,6.7,1293.0,6.743504777731616
19995,tt0499549,"Action, Adventure, Fantasy, Science Fiction",en,Avatar,"In the 22nd century, a paraplegic Marine is dispatched to the moon Pandora on a unique mission, but becomes torn between following orders and protecting an alien civilization.",185.070892,Avatar,7.2,12114.0,7.1658085878439675
10528,tt0988045,"Action, Adventure, Crime, Mystery",en,Sherlock Holmes,"Eccentric consulting detective, Sherlock Holmes and Doctor John Watson battle to bring down a new nemesis and unravel a deadly plot that could destroy England.",15.68604,Sherlock Holmes,7.0,5883.0,6.967202515363727
28178,tt1028532,"Drama, Family",en,Hachi: A Dog's Tale,A drama based on the true story of a college professor's bond with the abandoned dog he takes into his home.,8.621359,Hachi: A Dog's Tale,7.7,1769.0,7.349918834547346
20504,tt1037705,"Action, Thriller, Science Fiction",en,The Book of Eli,"A post-apocalyptic tale, in which a lone man fights his way across America in order to protect a sacred book that holds the secrets to saving humankind.",14.39853,The Book of Eli,6.6,2207.0,6.665075579644684
11324,tt1130884,"Drama, Thriller, Mystery",en,Shutter Island,"World War II soldier-turned-U.S. Marshal Teddy Daniels investigates the disappearance of a patient from a hospital for the criminally insane, but his efforts are compromised by his troubling visions and also by a mysterious doctor.",15.813629,Shutter Island,7.8,6559.0,7.653944480646422
32657,tt0814255,"Adventure, Fantasy, Family",en,Percy Jackson & the Olympians: The Lightning Thief,"Accident prone teenager, Percy discovers he's actually a demi-God, the son of Poseidon, and he is needed when Zeus' lightning is stolen. Percy must master his new found skills in order to prevent a war between the Gods that could devastate the entire world.",9.785895,Percy Jackson & the Olympians: The Lightning Thief,6.0,2079.0,6.2770172251800815
22971,tt0989757,"Drama, Romance, War",en,Dear John,Sergeant John Tyree is home on a 2 week leave from Germany. He meets Savannah after he dives into the ocean to retrieve Savannah's purse that had fallen off the pier. John falls in love with Savannah who is a student on spring break helping build a house for Habitat for Humanity. A romance occurs and Savannah falls deeply in love with John. She promises to write John overseas until he returns.,8.371479,Dear John,6.6,1302.0,6.689451986754967
12155,tt1014759,"Family, Fantasy, Adventure",en,Alice in Wonderland,"Alice, an unpretentious and individual 19-year-old, is betrothed to a dunce of an English nobleman. At her engagement party, she escapes the crowd to consider whether to go through with the marriage and falls down a hole in the garden after spotting an unusual rabbit. Arriving in a strange and surreal place called 'Underland,' she finds herself in a world that resembles the nightmares she had as a child, filled with talking animals, villainous queens and knights, and frumious bandersnatches. Alice realizes that she is there for a reason – to conquer the horrific Jabberwocky and restore the rightful queen to her throne.",17.285093,Alice in Wonderland,6.4,4773.0,6.474556820112112
10191,tt0892769,"Fantasy, Adventure, Animation, Family",en,How to Train Your Dragon,"As the son of a Viking leader on the cusp of manhood, shy Hiccup Horrendous Haddock III faces a rite of passage: he must kill a dragon to prove his warrior mettle. But after downing a feared dragon, he realizes that he no longer wants to destroy it, and instead befriends the beast – which he names Toothless – much to the chagrin of his warrior father",14.416681,How to Train Your Dragon,7.5,4319.0,7.3552394625437145
18823,tt0800320,"Adventure, Fantasy, Action",en,Clash of the Titans,"Born of a god but raised as a man, Perseus is helpless to save his family from Hades, vengeful god of the underworld. With nothing to lose, Perseus volunteers to lead a dangerous mission to defeat Hades before he can seize power from Zeus and unleash hell on earth. Battling unholy demons and fearsome beasts, Perseus and his warriors will only survive if Perseus accepts his power as a god, defies fate and creates his own destiny.",11.972347,Clash of the Titans,5.6,2280.0,5.991902180318208
23483,tt1250777,"Action, Crime",en,Kick-Ass,"Dave Lizewski is an unnoticed high school student and comic book fan who one day decides to become a super-hero, even though he has no powers, training or meaningful reason to do so.",17.26045,Kick-Ass,7.1,4747.0,7.04183859409657
35056,tt1279935,Comedy,en,Date Night,"Phil and Claire Foster fear that their mild-mannered relationship may be falling into a stale rut. During their weekly date night, their dinner reservation leads to their being mistaken for a couple of thieves – and now a number of unsavoury characters want Phil and Claire killed.",8.443736,Date Night,5.9,1148.0,6.340281167108753
10138,tt1228705,"Adventure, Action, Science Fiction",en,Iron Man 2,"With the world now aware of his dual life as the armored superhero Iron Man, billionaire inventor Tony Stark faces pressure from the government, the press and the public to share his technology with the military. Unwilling to let go of his invention, Stark, with Pepper Potts and James 'Rhodey' Rhodes at his side, must forge new alliances – and confront powerful enemies.",19.083344,Iron Man 2,6.6,6969.0,6.62673710256093
20662,tt0955308,"Action, Adventure",en,Robin Hood,"When soldier Robin happens upon the dying Robert of Loxley, he promises to return the man's sword to his family in Nottingham. There, he assumes Robert's identity; romances his widow, Marion; and draws the ire of the town's sheriff and King John's henchman, Godfrey.",10.56812,Robin Hood,6.2,1434.0,6.459700156985871
9543,tt0473075,"Adventure, Fantasy, Action, Romance",en,Prince of Persia: The Sands of Time,"A rogue prince reluctantly joins forces with a mysterious princess and together, they race against dark forces to safeguard an ancient dagger capable of releasing the Sands of Time – gift from the gods that can reverse time and allow its possessor to rule the world.",18.459955,Prince of Persia: The Sands of Time,6.2,2372.0,6.38982099827883
34544,tt0429493,"Thriller, Action, Adventure, Comedy, Crime",en,The A-Team,"A group of Iraq War veterans goes on the run from U.S. military forces while they try to clear their names after being framed for a crime they didn't commit. Along the way, Col. Hannibal Smith, Capt. H.M. ‘Howling Mad’ Murdock , Sgt. Bosco ‘B.A.’ Baracus, and Lt. Templeton ‘Faceman’ Peck help out various people they encounter.",16.747793,The A-Team,6.2,1737.0,6.4320996141704665
10193,tt0435761,"Animation, Family, Comedy",en,Toy Story 3,"Woody, Buzz, and the rest of Andy's toys haven't been played with in years. With Andy about to go to college, the gang find themselves accidentally left at a nefarious day care center. The toys must band together to escape and return home to Andy.",16.96647,Toy Story 3,7.6,4710.0,7.445830357142857
10192,tt0892791,"Comedy, Adventure, Fantasy, Animation, Family",en,Shrek Forever After,"A bored and domesticated Shrek pacts with deal-maker Rumpelstiltskin to get back to feeling like a real ogre again, but when he's duped and sent to a twisted version of Far Far Away—where Rumpelstiltskin is king, ogres are hunted, and he and Fiona have never met—he sets out to restore his world and reclaim his true love.",11.803808,Shrek Forever After,6.0,2021.0,6.282142264752791
24021,tt1325004,"Adventure, Fantasy, Drama, Romance",en,The Twilight Saga: Eclipse,"Bella once again finds herself surrounded by danger as Seattle is ravaged by a string of mysterious killings and a malicious vampire continues her quest for revenge. In the midst of it all, she is forced to choose between her love for Edward and her friendship with Jacob, knowing that her decision has the potential to ignite the ageless struggle between vampire and werewolf. With her graduation quickly approaching, Bella is confronted with the most important decision of her life.",34.047399,The Twilight Saga: Eclipse,5.9,2382.0,6.18487299771167
10196,tt0938283,"Action, Adventure, Family, Fantasy",en,The Last Airbender,"The story follows the adventures of Aang, a young successor to a long line of Avatars, who must put his childhood ways aside and stop the Fire Nation from enslaving the Water, Earth and Air nations.",9.544657,The Last Airbender,4.7,1180.0,5.716877070619006
34851,tt1424381,"Action, Science Fiction, Adventure, Thriller",en,Predators,"A mercenary reluctantly leads a motley crew of warriors who soon come to realize they've been captured and deposited on an alien planet by an unknown nemesis. With the exception of a peculiar physician, they are all cold-blooded killers, convicts, death squad members... hunters who have now become the hunted.",9.034929,Predators,6.0,1231.0,6.377192324093817
20352,tt1323594,"Animation, Family",en,Despicable Me,"Villainous Gru lives up to his reputation as a despicable, deplorable and downright unlikable guy when he hatches a plan to steal the moon from the sky. But he has a tough time staying on task after three orphans land in his care.",22.274502,Despicable Me,7.1,6595.0,7.055781035153715
27205,tt1375666,"Action, Thriller, Science Fiction, Mystery, Adventure",en,Inception,"Cobb, a skilled thief who commits corporate espionage by infiltrating the subconscious of his targets is offered a chance to regain his old life as payment for a task considered to be impossible: ""inception"", the implantation of another person's idea into a target's subconscious.",29.108149,Inception,8.1,14075.0,8.004214629007834
38365,tt1375670,Comedy,en,Grown Ups,"After their high school basketball coach passes away, five good friends and former teammates reunite for a Fourth of July holiday weekend.",23.981251,Grown Ups,6.0,1746.0,6.309271328671329
27022,tt0963966,"Fantasy, Adventure, Action, Comedy, Drama",en,The Sorcerer's Apprentice,"Balthazar Blake is a master sorcerer in modern-day Manhattan trying to defend the city from his arch-nemesis, Maxim Horvath. Balthazar can't do it alone, so he recruits Dave Stutler, a seemingly average guy who demonstrates hidden potential, as his reluctant protégé. The sorcerer gives his unwilling accomplice a crash course in the art and science of magic, and together, these unlikely partners work to stop the forces of darkness.",12.533525,The Sorcerer's Apprentice,5.9,1526.0,6.277240909090909
37834,tt1013743,"Action, Comedy",en,Knight and Day,"A fugitive couple goes on a glamorous and sometimes deadly adventure where nothing and no one – even themselves – are what they seem. Amid shifting alliances and unexpected betrayals, they race across the globe, with their survival ultimately hinging on the battle of truth vs. trust.",12.758942,Knight and Day,5.9,1583.0,6.2692680756396
38575,tt1155076,"Action, Adventure, Drama, Family",en,The Karate Kid,"12-year-old Dre Parker could have been the most popular kid in Detroit, but his mother's latest career move has landed him in China. Dre immediately falls for his classmate Mei Ying but the cultural differences make such a friendship impossible. Even worse, Dre's feelings make him an enemy of the class bully, Cheng. With no friends in a strange land, Dre has nowhere to turn but maintenance man Mr. Han, who is a kung fu master. As Han teaches Dre that kung fu is not about punches and parries, but maturity and calm, Dre realizes that facing down the bullies will be the fight of his life.",11.690781,The Karate Kid,6.2,1675.0,6.437259232699892
