id,imdb_id,genres,original_language,original_title,overview,popularity,title,vote_average,vote_count,weighted_rating
453,tt0268978,"Drama, Romance",en,A Beautiful Mind,"At Princeton University, John Nash struggles to make a worthwhile contribution to serve as his legacy to the world of mathematics. He finally makes a revolutionary breakthrough that will eventually earn him the Nobel Prize. After graduate school he turns to teaching, becoming romantically involved with his student Alicia. Meanwhile the government asks his help with breaking Soviet codes, which soon gets him involved in a terrifying conspiracy plot. Nash grows more and more paranoid until a discovery that turns his entire world upside down. Now it is only with Alicia's help that he will be able to recover his mental strength and regain his status as the great mathematician we know him as today..",11.93646,A Beautiful Mind,7.7,3087.0,7.4597514877410145
855,tt0265086,"Action, History, War",en,Black Hawk Down,"When U.S. Rangers and an elite Delta Force team attempt to kidnap two underlings of a Somali warlord, their Black Hawk helicopters are shot down, and the Americans suffer heavy casualties, facing intense fighting from the militia on the ground.",10.064446,Black Hawk Down,7.2,1832.0,7.046475220638154
425,tt0268380,"Animation, Comedy, Family, Adventure",en,Ice Age,"With the impending ice age almost upon them, a mismatched trio of prehistoric critters – Manny the woolly mammoth, Diego the saber-toothed tiger and Sid the giant sloth – find an orphaned infant and decide to return it to its human parents. Along the way, the unlikely allies become friends but, when enemies attack, their quest takes on far nobler aims.",17.328902,Ice Age,7.1,3954.0,7.032737963693765
1576,tt0120804,"Horror, Action, Science Fiction",en,Resident Evil,"When a virus leaks from a top-secret facility, turning all resident researchers into ravenous zombies and their lab animals into mutated hounds from hell, the government sends in an elite military task force to contain the outbreak. Alice and Rain are charged with leading the mission. But they only have three hours before the pathogen becomes airborne and infects the world.",7.781293,Resident Evil,6.4,2100.0,6.536563783447417
36586,tt0187738,"Fantasy, Horror, Action, Thriller",en,Blade II,"A rare mutation has occurred within the vampire community - The Reaper. A vampire so consumed with an insatiable bloodlust that they prey on vampires as well as humans, transforming victims who are unlucky enough to survive into Reapers themselves. Blade is asked by the Vampire Nation for his help in preventing a nightmare plague that would wipe out both humans and vampires.",17.05064,Blade II,6.3,1556.0,6.50611086142322
4547,tt0258000,"Crime, Drama, Thriller",en,Panic Room,"Trapped in their New York brownstone's panic room, a hidden chamber built as a sanctuary in the event of break-ins, newly divorced Meg Altman and her young daughter Sarah play a deadly game of cat-and-mouse with three intruders - Burnham, Raoul and Junior - during a brutal home invasion. But the room itself is the focal point because what the intruders really want is inside it.",14.969502,Panic Room,6.6,1303.0,6.6894149772445175
557,tt0145487,"Fantasy, Action",en,Spider-Man,"After being bitten by a genetically altered spider, nerdy high school student Peter Parker is endowed with amazing powers.",29.413341,Spider-Man,6.8,5398.0,6.798973587223587
1894,tt0121765,"Adventure, Action, Science Fiction",en,Star Wars: Episode II - Attack of the Clones,"Ten years after the invasion of Naboo, the galaxy is on the brink of civil war. Under the leadership of a renegade Jedi named Count Dooku, thousands of solar systems threaten to break away from the Galactic Republic. When an assassination attempt is made on Senator Padmé Amidala, the former Queen of Naboo, twenty-year-old Jedi apprentice Anakin Skywalker is assigned to protect her. In the course of his mission, Anakin discovers his love for Padmé as well as his own darker side. Soon, Anakin, Padmé, and Obi-Wan Kenobi are drawn into the heart of the Separatist movement and the beginning of the Clone Wars.",14.072511,Star Wars: Episode II - Attack of the Clones,6.4,4074.0,6.484602158828064
320,tt0278504,"Crime, Mystery, Thriller",en,Insomnia,Two Los Angeles homicide detectives are dispatched to a northern town where the sun doesn't set to investigate the methodical murder of a local teen.,11.424974,Insomnia,6.8,1181.0,6.797087581699346
2501,tt0258463,"Action, Drama, Mystery, Thriller",en,The Bourne Identity,"Wounded to the brink of death and suffering from amnesia, Jason Bourne is rescued at sea by a fisherman. With nothing to go on but a Swiss bank account number, he starts to reconstruct his life, but finds that many people he encounters want him dead. However, Bourne realizes that he has the combat and mental skills of a world-class spy – but who does he work for?",21.040126,The Bourne Identity,7.3,3640.0,7.181429533024821
11544,tt0275847,"Animation, Family",en,Lilo & Stitch,"A lonely Hawaiian girl named Lilo is being raised by her older sister, Nani, after their parents die -- under the watch of social worker Cobra Bubbles. When Lilo adopts a funny-looking dog and names him ""Stitch,"" she doesn't realize her new best friend is a wacky alien created by mad scientist Dr. Jumba.",18.469238,Lilo & Stitch,7.1,1371.0,6.9628233400402415
180,tt0181689,"Action, Thriller, Science Fiction, Mystery",en,Minority Report,"John Anderton is a top 'Precrime' cop in the late-21st century, when technology can predict crimes before they're committed. But Anderton becomes the quarry when another investigator targets him for a murder charge.",20.666063,Minority Report,7.1,2663.0,7.009747418586179
608,tt0120912,"Action, Adventure, Comedy, Science Fiction",en,Men in Black II,"Kay and Jay reunite to provide our best, last and only line of defense against a sinister seductress who levels the toughest challenge yet to the MIB's untarnished mission statement – protecting Earth from the scum of the universe. It's been four years since the alien-seeking agents averted an intergalactic disaster of epic proportions. Now it's a race against the clock as Jay must convince Kay – who not only has absolutely no memory of his time spent with the MIB, but is also the only living person left with the expertise to save the galaxy – to reunite with the MIB before the earth submits to ultimate destruction.",16.775716,Men in Black II,6.1,3188.0,6.279710832171083
2675,tt0286106,"Drama, Thriller, Science Fiction, Mystery",en,Signs,A family living on a farm finds mysterious crop circles in their fields which suggests something more frightening to come.,11.211568,Signs,6.4,1624.0,6.560305332359386
7451,tt0295701,"Action, Adventure, Thriller",en,xXx,"Xander Cage is your standard adrenaline junkie with no fear and a lousy attitude. When the US Government ""recruits"" him to go on a mission, he's not exactly thrilled. His mission: to gather information on an organization that may just be planning the destruction of the world, led by the nihilistic Yorgi.",12.722381,xXx,5.8,1454.0,6.231197819314641
4108,tt0293662,"Action, Crime, Thriller",en,The Transporter,"Former Special Forces officer, Frank Martin will deliver anything to anyone for the right price, and his no-questions-asked policy puts him in high demand. But when he realizes his latest cargo is alive, it sets in motion a dangerous chain of events. The bound and gagged Lai is being smuggled to France by a shady American businessman, and Frank works to save her as his own illegal activities are uncovered by a French detective.",13.217421,The Transporter,6.6,1724.0,6.6761508104298795
129,tt0245429,"Fantasy, Adventure, Animation, Family",ja,千と千尋の神隠し,A ten year old girl who wanders away from her parents along a path that leads to a world ruled by strange and unusual monster-like animals. Her parents have been changed into pigs along with others inside a bathhouse full of these creatures. Will she ever see the world how it once was?,41.048867,Spirited Away,8.3,3968.0,7.969877213695395
9533,tt0289765,"Crime, Thriller, Horror",en,Red Dragon,"Former FBI Agent Will Graham, who was once almost killed by the savage Hannibal 'The Cannibal' Lecter, now has no choice but to face him again, as it seems Lecter is the only one who can help Graham track down a new serial killer.",2.968157,Red Dragon,6.7,1142.0,6.746416666666667
565,tt0298130,"Horror, Mystery",en,The Ring,"It sounded like just another urban legend: A videotape filled with nightmarish images, leading to a phone call foretelling the viewer's death in exactly seven days. As a newspaper reporter, Rachel Keller was naturally skeptical of the story, until four teenagers all met with mysterious deaths exactly one week after watching just such a tape. Allowing her investigative curiosity to get the better of her, Rachel tracks down the video... and watches it. Now she has just seven days to unravel the mystery of the Ring.",13.740965,The Ring,6.5,1720.0,6.615566690190544
65,tt0298203,Drama,en,8 Mile,"The setting is Detroit in 1995. The city is divided by 8 Mile, a road that splits the town in half along racial lines. A young white rapper, Jimmy ""B-Rabbit"" Smith Jr. summons strength within himself to cross over these arbitrary boundaries to fulfill his dream of success in hip hop. With his pal Future and the three one third in place, all he has to do is not choke.",8.374355,8 Mile,6.8,1676.0,6.797604301075269
672,tt0295297,"Adventure, Fantasy, Family",en,Harry Potter and the Chamber of Secrets,"Ignoring threats to his life, Harry returns to Hogwarts to investigate – aided by Ron and Hermione – a mysterious series of attacks.",29.741452,Harry Potter and the Chamber of Secrets,7.4,5966.0,7.304649152542373
7299,tt0238380,"Action, Science Fiction, Thriller",en,Equilibrium,"In a dystopian future, a totalitarian regime maintains peace by subduing the populace with a drug, and displays of emotion are punishable by death. A man in charge of enforcing the law rises to overthrow the system.",12.671637,Equilibrium,6.9,1584.0,6.85623276501112
121,tt0167261,"Adventure, Fantasy, Action",en,The Lord of the Rings: The Two Towers,"Frodo and Sam are trekking to Mordor to destroy the One Ring of Power while Gimli, Legolas and Aragorn search for the orc-captured Merry and Pippin. All along, nefarious wizard Saruman awaits the Fellowship members at the Orthanc Tower in Isengard.",29.423537,The Lord of the Rings: The Two Towers,8.0,7641.0,7.84654665905197
3131,tt0217505,"Drama, History, Crime",en,Gangs of New York,"It's 1863. America was born in the streets. Amsterdam Vallon returns to the Five Points of America to seek vengeance against the psychotic gangland kingpin, Bill the Butcher, who murdered his father years earlier. With an eager pickpocket by his side and a whole new army, Vallon fights his way to seek vengeance on the Butcher and restore peace in the area.",14.922399,Gangs of New York,7.1,1964.0,6.989251461988303
8392,tt0096283,"Fantasy, Animation, Family",ja,となりのトトロ,"Two sisters move to the country with their father in order to be closer to their hospitalized mother, and discover the surrounding trees are inhabited by Totoros, magical spirits of the forest. When the youngest runs away from home, the older sister seeks help from the spirits to find her.",13.507299,My Neighbor Totoro,8.0,1730.0,7.527607594936709
640,tt0264464,"Drama, Crime",en,Catch Me If You Can,"A true story about Frank Abagnale Jr. who, before his 19th birthday, successfully conned millions of dollars worth of checks as a Pan Am pilot, doctor, and legal prosecutor. An FBI agent makes it his mission to put him behind bars. But Frank not only eludes capture, he revels in the pursuit.",19.833077,Catch Me If You Can,7.7,3917.0,7.499387000596302
423,tt0253474,"Drama, War",en,The Pianist,The Pianist is a film adapted from the biography of Wladyslaw Szpilman. A Jewish-Polish pianist who during the second world war lived and hid miraculously in Warsaw after having gone through a terrible tragedy. A film from Roman Polanski.,14.811594,The Pianist,8.1,1927.0,7.621577112791844
598,tt0317248,"Drama, Crime",pt,Cidade de Deus,"Cidade de Deus is a shantytown that started during the 1960s and became one of Rio de Janeiro’s most dangerous places in the beginning of the 1980s. To tell the story of this place, the movie describes the life of various characters, all seen by the point of view of the narrator, Buscapé. Buscapé was raised in a very violent environment. Despite the feeling that all odds were against him, he finds out that life can be seen with other eyes: The eyes of an artist. By accident, he becomes a professional photographer, gaining his freedom.",14.95927,City of God,8.2,1852.0,7.671920431557654
9480,tt0287978,"Fantasy, Action, Crime, Science Fiction, Thriller",en,Daredevil,"He dwells in a world of eternal night, but the blackness is filled with sounds and scents, tastes and textures that most cannot perceive. Although attorney Matt Murdock is blind, his other four senses function with superhuman sharpness. By day, Murdock represents the downtrodden. At night he is Daredevil, a masked vigilante stalking the dark streets of the city, a relentless avenger of justice.",11.415558,Daredevil,5.0,1551.0,5.749912195121951
36658,tt0290334,"Adventure, Action, Science Fiction, Thriller",en,X2,"Professor Charles Xavier and his team of genetically gifted superheroes face a rising tide of anti-mutant sentiment led by Col. William Stryker. Storm, Wolverine and Jean Grey must join their usual nemeses –  Magneto and Mystique – to unhinge Stryker's scheme to exterminate all mutants.",0.913096,X2,6.8,3572.0,6.798573623559538
604,tt0234215,"Adventure, Action, Thriller, Science Fiction",en,The Matrix Reloaded,"Six months after the events depicted in The Matrix, Neo has proved to be a good omen for the free humans, as more and more humans are being freed from the matrix and brought to Zion, the one and only stronghold of the Resistance.  Neo himself has discovered his superpowers including super speed, ability to see the codes of the things inside the matrix and a certain degree of pre-cognition. But a nasty piece of news hits the human resistance: 250,000 machine sentinels are digging to Zion and would reach them in 72 hours. As Zion prepares for the ultimate war, Neo, Morpheus and Trinity are advised by the Oracle to find the Keymaker who would help them reach the Source.  Meanwhile Neo's recurrent dreams depicting Trinity's death have got him worried and as if it was not enough, Agent Smith has somehow escaped deletion, has become more powerful than before and has fixed Neo as his next target.",16.229317,The Matrix Reloaded,6.7,3500.0,6.722695275249242
310,tt0315327,"Fantasy, Comedy",en,Bruce Almighty,"Bruce Nolan toils as a ""human interest"" television reporter in Buffalo, N.Y. Despite his high ratings and the love of his beautiful girlfriend, Grace, Bruce remains unfulfilled. At the end of the worst day in his life, he angrily ridicules God -- and the Almighty responds, endowing Bruce with all of His divine powers.",15.947524,Bruce Almighty,6.4,3121.0,6.503640141676505
12,tt0266543,"Animation, Family",en,Finding Nemo,"Nemo, an adventurous young clownfish, is unexpectedly taken from his Great Barrier Reef home to a dentist's office aquarium. It's up to his worrisome father Marlin and a friendly but forgetful fish Dory to bring Nemo home -- meeting vegetarian sharks, surfer dude turtles, hypnotic jellyfish, hungry seagulls, and more along the way.",25.497794,Finding Nemo,7.6,6292.0,7.478762624898731
9654,tt0317740,"Action, Crime",en,The Italian Job,"Charlie Croker pulled off the crime of a lifetime. The one thing that he didn't plan on was being double-crossed. Along with a drop-dead gorgeous safecracker, Croker and his team take off to re-steal the loot and end up in a pulse-pounding, pedal-to-the-metal chase that careens up, down, above and below the streets of Los Angeles.",13.995044,The Italian Job,6.6,1949.0,6.670556970290564
584,tt0322259,"Action, Crime, Thriller",en,2 Fast 2 Furious,"It's a major double-cross when former police officer Brian O'Conner teams up with his ex-con buddy Roman Pearce to transport a shipment of ""dirty"" money for shady Miami-based import-export dealer Carter Verone. But the guys are actually working with undercover agent Monica Fuentes to bring Verone down.",2.32462,2 Fast 2 Furious,6.2,2087.0,6.4067216494845365
170,tt0289043,"Horror, Thriller, Science Fiction",en,28 Days Later,"Twenty-eight days after a killer virus was accidentally unleashed from a British research facility, a small group of London survivors are caught in a desperate struggle to protect themselves from the infected. Carried by animals and humans, the virus turns those it infects into homicidal maniacs -- and it's absolutely impossible to contain.",17.656951,28 Days Later,7.1,1816.0,6.983657337883958
1927,tt0286716,"Drama, Action, Science Fiction",en,Hulk,"Bruce Banner, a genetics researcher with a tragic past, suffers massive radiation exposure in his laboratory that causes him to transform into a raging green monster when he gets angry.",15.422638,Hulk,5.3,1571.0,5.919856983240223
296,tt0181852,"Action, Thriller, Science Fiction",en,Terminator 3: Rise of the Machines,"It's been 10 years since John Connor saved Earth from Judgment Day, and he's now living under the radar, steering clear of using anything Skynet can trace. That is, until he encounters T-X, a robotic assassin ordered to finish what T-1000 started. Good thing Connor's former nemesis, the Terminator, is back to aid the now-adult Connor … just like he promised.",20.818907,Terminator 3: Rise of the Machines,5.9,2177.0,6.202618049225159
22,tt0325980,"Adventure, Fantasy, Action",en,Pirates of the Caribbean: The Curse of the Black Pearl,"Jack Sparrow, a freewheeling 17th-century pirate who roams the Caribbean Sea, butts heads with a rival pirate bent on pillaging the village of Port Royal. When the governor's daughter is kidnapped, Sparrow decides to help the girl's love save her. But their seafaring mission is hardly simple.",47.326665,Pirates of the Caribbean: The Curse of the Black Pearl,7.5,7191.0,7.405299939795304
8698,tt0311429,"Fantasy, Action, Thriller, Science Fiction",en,The League of Extraordinary Gentlemen,"To prevent a world war from breaking out, famous characters from Victorian literature band together to do battle against a cunning villain.",10.488765,The League of Extraordinary Gentlemen,5.7,1181.0,6.231030936819172
8961,tt0172156,"Adventure, Action, Comedy, Thriller, Crime",en,Bad Boys II,"Out-of-control, trash-talking buddy cops Marcus Burnett and Mike Lowrey of the Miami Narcotics Task Force reunite, and bullets fly, cars crash and laughs explode as they pursue a whacked-out drug lord from the streets of Miami to the barrios of Cuba. But the real fireworks result when Marcus discovers that playboy Mike is secretly romancing Marcus’ sexy sister.",8.191436,Bad Boys II,6.3,1588.0,6.503669874167283
1996,tt0325703,"Action, Adventure, Fantasy, Thriller",en,Lara Croft Tomb Raider: The Cradle of Life,"Lara Croft ventures to an underwater temple in search of the mythological Pandora's Box but, after securing it, it is promptly stolen by the villainous leader of a Chinese crime syndicate. Lara must recover the box before the syndicate's evil mastermind uses it to construct a weapon of catastrophic capabilities.",13.076349,Lara Croft Tomb Raider: The Cradle of Life,5.5,1443.0,6.063752835353931
8273,tt0328828,"Comedy, Romance",en,American Wedding,"With high school a distant memory, Jim and Michelle are getting married -- and in a hurry, since Jim's grandmother is sick and wants to see him walk down the aisle -- prompting Stifler to throw the ultimate bachelor party. And Jim's dad is reliable as ever, doling out advice no one wants to hear.",14.397139,American Wedding,6.0,1158.0,6.38931161971831
153,tt0335266,Drama,en,Lost in Translation,"Two lost souls visiting Tokyo -- the young, neglected wife of a photographer and a washed-up movie star shooting a TV commercial -- find an odd solace and pensive freedom to be real in each other's company, away from their lives in America.",11.609441,Lost in Translation,7.3,1943.0,7.115608766764802
277,tt0320691,"Fantasy, Action, Thriller",en,Underworld,"Vampires and werewolves have waged a nocturnal war against each other for centuries. But all bets are off when a female vampire warrior named Selene, who's famous for her strength and werewolf-hunting prowess, becomes smitten with a peace-loving male werewolf, Michael, who wants to end the war.",20.624333,Underworld,6.6,2556.0,6.658887193460489
1584,tt0332379,"Comedy, Music",en,School of Rock,"Fired from his band and hard up for cash, guitarist and vocalist Dewey Finn finagles his way into a job as a fourth-grade substitute teacher at a private school, where he secretly begins teaching his students the finer points of rock 'n' roll. The school's hard-nosed principal is rightly suspicious of Finn's activities. But Finn's roommate remains in the dark about what he's doing.",17.95142,School of Rock,6.8,1454.0,6.797397196261683
322,tt0327056,"Thriller, Crime, Drama, Mystery",en,Mystic River,"A story about friendship and loyalty, guilt and vengeance, and the fateful affect the past has on the present.",12.602438,Mystic River,7.6,1473.0,7.252924623115577
24,tt0266697,"Action, Crime",en,Kill Bill: Vol. 1,"An assassin is shot at the altar by her ruthless employer, Bill and other members of their assassination circle – but 'The Bride' lives to plot her vengeance. Setting out for some payback, she makes a death list and hunts down those who wronged her, saving Bill for last.",25.261865,Kill Bill: Vol. 1,7.7,5091.0,7.537343432715552
10009,tt0328880,"Adventure, Animation, Family",en,Brother Bear,"When an impulsive boy named Kenai is magically transformed into a bear, he must literally walk in another's footsteps until he learns some valuable life lessons. His courageous and often zany journey introduces him to a forest full of wildlife, including the lovable bear cub Koda, hilarious moose Rutt and Tuke, woolly mammoths and rambunctious rams.",12.300905,Brother Bear,6.9,1410.0,6.853215530903328
605,tt0242653,"Adventure, Action, Thriller, Science Fiction",en,The Matrix Revolutions,The human city of Zion defends itself against the massive invasion of the machines as Neo fights to end the war at another front while also opposing the rogue Agent Smith.,15.368205,The Matrix Revolutions,6.4,3155.0,6.502814710705083
508,tt0314331,"Comedy, Romance, Drama",en,Love Actually,Follows seemingly unrelated people as their lives begin to intertwine while they fall in – and out – of love. Affections languish and develop as Christmas draws near.,10.586815,Love Actually,7.0,1917.0,6.9242876938304185
616,tt0325710,"Drama, Action, War, History",en,The Last Samurai,"Nathan Algren is an American hired to instruct the Japanese army in the ways of modern warfare, which finds him learning to respect the samurai and the honorable principles that rule them. Pressed to destroy the samurai's way of life in the name of modernization and open trade, Algren decides to become an ultimate warrior himself and to fight for their right to exist.",19.582325,The Last Samurai,7.3,1946.0,7.115789542483659
587,tt0319061,"Adventure, Fantasy, Drama",en,Big Fish,"Throughout his life Edward Bloom has always been a man of big appetites, enormous passions and tall tales. In his later years, he remains a huge mystery to his son, William. Now, to get to know the real man, Will begins piecing together a true picture of his father from flashbacks of his amazing adventures.",14.739983,Big Fish,7.6,2064.0,7.317468848332284
122,tt0167260,"Adventure, Fantasy, Action",en,The Lord of the Rings: The Return of the King,"Aragorn is revealed as the heir to the ancient kings as he, Gandalf and the other members of the broken fellowship struggle to save Gondor from Sauron's forces. Meanwhile, Frodo and Sam bring the ring closer to the heart of Mordor, the dark lord's realm.",29.324358,The Lord of the Rings: The Return of the King,8.1,8226.0,7.944230835117772
1954,tt0289879,"Science Fiction, Thriller",en,The Butterfly Effect,"A young man struggles to access sublimated childhood memories. He finds a technique that allows him to travel back into the past, to occupy his childhood body and change history. However, he soon finds that every change he makes has unexpected consequences.",12.994939,The Butterfly Effect,7.3,2119.0,7.125646767708011
1824,tt0343660,"Comedy, Romance",en,50 First Dates,"Henry is a player skilled at seducing women. But when this veterinarian meets Lucy, a girl with a quirky problem when it comes to total recall, he realizes it's possible to fall in love all over again…and again, and again. That's because the delightful Lucy has no short-term memory, so Henry must woo her day after day until he finally sweeps her off her feet.",11.134888,50 First Dates,6.6,2161.0,6.66598961832061
38,tt0338013,"Science Fiction, Drama, Romance",en,Eternal Sunshine of the Spotless Mind,"Joel Barish, heartbroken that his girlfriend underwent a procedure to erase him from her memory, decides to do the same. However, as he watches his memories of her fade away, he realises that he still loves her, and may be too late to correct his mistake.",12.906327,Eternal Sunshine of the Spotless Mind,7.9,3758.0,7.647109195402298
