id,imdb_id,genres,original_language,original_title,overview,popularity,title,vote_average,vote_count,weighted_rating
82700,tt1815862,"Science Fiction, Action, Adventure",en,After Earth,"One thousand years after cataclysmic events forced humanity's escape from Earth, Nova Prime has become mankind's new home. Legendary General Cypher Raige returns from an extended tour of duty to his estranged family, ready to be a father to his 13-year-old son, Kitai. When an asteroid storm damages Cypher and Kitai's craft, they crash-land on a now unfamiliar and dangerous Earth. As his father lies dying in the cockpit, Kitai must trek across the hostile terrain to recover their rescue beacon. His whole life, Kitai has wanted nothing more than to be a soldier like his father. Today, he gets his chance.",10.747642,After Earth,5.0,2579.0,5.541163281884646
75656,tt1670345,"Thriller, Crime",en,Now You See Me,An FBI agent and an Interpol detective track a team of illusionists who pull off bank heists during their performances and reward their audiences with the money.,17.852022,Now You See Me,7.3,5635.0,7.2164788857608535
49521,tt0770828,"Action, Adventure, Fantasy, Science Fiction",en,Man of Steel,"A young boy learns that he has extraordinary powers and is not of this earth. As a young man, he journeys to discover where he came from and what he was sent here to do. But the hero in him must emerge if he is to save the world from annihilation and become the symbol of hope for all mankind.",18.538834,Man of Steel,6.5,6462.0,6.543230728616684
158015,tt2184339,"Science Fiction, Horror, Thriller",en,The Purge,"Given the country's overcrowded prisons, the U.S. government begins to allow 12-hour periods of time in which all illegal activity is legal. During one of these free-for-alls, a family must protect themselves from a home invasion.",23.207663,The Purge,6.0,2498.0,6.24488261351052
96936,tt2132285,"Drama, Crime",en,The Bling Ring,"Inspired by actual events, a group of fame-obsessed teenagers use the Internet to track celebrities' whereabouts in order to rob their homes.",7.913029,The Bling Ring,5.3,1205.0,6.017686934023285
62211,tt1453405,"Animation, Family",en,Monsters University,A look at the relationship between Mike and Sulley during their days at Monsters University — when they weren't necessarily the best of friends.,16.267502,Monsters University,7.0,3622.0,6.951544763513513
68726,tt1663662,"Action, Science Fiction, Adventure",en,Pacific Rim,"When legions of monstrous creatures, known as Kaiju, started rising from the sea, a war began that would take millions of lives and consume humanity's resources for years on end. To combat the giant Kaiju, a special type of weapon was devised: massive robots, called Jaegers, which are controlled simultaneously by two pilots whose minds are locked in a neural bridge. But even the Jaegers are proving nearly defenseless in the face of the relentless Kaiju. On the verge of defeat, the forces defending mankind have no choice but to turn to two unlikely heroes—a washed-up former pilot (Charlie Hunnam) and an untested trainee (Rinko Kikuchi)—who are teamed to drive a legendary but seemingly obsolete Jaeger from the past. Together, they stand as mankind's last hope against the mounting apocalypse.",33.949359,Pacific Rim,6.7,4903.0,6.717403357154728
72190,tt0816711,"Action, Drama, Horror, Science Fiction, Thriller",en,World War Z,"Life for former United Nations investigator Gerry Lane and his family seems content. Suddenly, the world is plagued by a mysterious infection turning whole human populations into rampaging mindless zombies. After barely escaping the chaos, Lane is persuaded to go on a mission to investigate this disease. What follows is a perilous trek around the world where Lane must brave horrific dangers and long odds to find answers before human civilization falls.",26.114917,World War Z,6.7,5683.0,6.7154062086214505
68724,tt1535108,"Science Fiction, Action, Drama, Thriller",en,Elysium,"In the year 2159, two classes of people exist: the very wealthy who live on a pristine man-made space station called Elysium, and the rest, who live on an overpopulated, ruined Earth. Secretary Rhodes (Jodie Foster), a hard line government ofﬁcial, will stop at nothing to enforce anti-immigration laws and preserve the luxurious lifestyle of the citizens of Elysium. That doesn’t stop the people of Earth from trying to get in, by any means they can. When unlucky Max (Matt Damon) is backed into a corner, he agrees to take on a daunting mission that, if successful, will not only save his life, but could bring equality to these polarized worlds.",15.232738,Elysium,6.4,3510.0,6.4949212802768175
93456,tt1690953,"Animation, Comedy, Family",en,Despicable Me 2,Gru is recruited by the Anti-Villain League to help deal with a powerful new super criminal.,24.82355,Despicable Me 2,7.0,4729.0,6.9607249700496325
117251,tt2334879,"Action, Drama, Thriller",en,White House Down,"Capitol Policeman John Cale has just been denied his dream job with the Secret Service of protecting President James Sawyer. Not wanting to let down his little girl with the news, he takes her on a tour of the White House, when the complex is overtaken by a heavily armed paramilitary group. Now, with the nation's government falling into chaos and time running out, it's up to Cale to save the president, his daughter, and the country.",9.920223,White House Down,6.3,1910.0,6.481982804232803
107985,tt1213663,"Comedy, Action, Science Fiction",en,The World's End,Five friends who reunite in an attempt to top their epic pub crawl from 20 years earlier unwittingly become humankind's only hope for survival.,9.830382,The World's End,6.7,1820.0,6.735690524880709
136795,tt2404463,"Action, Comedy, Crime",en,The Heat,"Uptight and straight-laced, FBI Special Agent Sarah Ashburn is a methodical investigator with a reputation for excellence--and hyper-arrogance. Shannon Mullins, one of Boston P.D.'s ""finest,"" is foul-mouthed and has a very short fuse, and uses her gut instinct and street smarts to catch the most elusive criminals. Neither has ever had a partner, or a friend for that matter. When these two wildly incompatible law officers join forces to bring down a ruthless drug lord, they become the last thing anyone expected: Buddies.",12.706403,The Heat,6.5,1595.0,6.620899224806202
57201,tt1210819,"Action, Adventure, Western",en,The Lone Ranger,"The Texas Rangers chase down a gang of outlaws led by Butch Cavendish, but the gang ambushes the Rangers, seemingly killing them all. One survivor is found, however, by an American Indian named Tonto, who nurses him back to health. The Ranger, donning a mask and riding a white stallion named Silver, teams up with Tonto to bring the unscrupulous gang and others of that ilk to justice.",12.729104,The Lone Ranger,5.9,2361.0,6.186594532374102
49524,tt0790736,"Fantasy, Action, Comedy, Crime",en,R.I.P.D.,A recently slain cop joins a team of undead police officers working for the Rest in Peace Department and tries to find the man who murdered him. Based on the comic by Peter M. Lenkov.,9.369679,R.I.P.D.,5.4,1280.0,6.048670008354218
138843,tt1457767,"Horror, Thriller",en,The Conjuring,"Paranormal investigators Ed and Lorraine Warren work to help a family terrorized by a dark presence in their farmhouse. Forced to confront a powerful entity, the Warrens find themselves caught in the most terrifying case of their lives.",14.90169,The Conjuring,7.4,3169.0,7.2423805743637635
76170,tt1430132,"Action, Science Fiction, Adventure, Fantasy",en,The Wolverine,"Wolverine faces his ultimate nemesis - and tests of his physical, emotional, and mortal limits - in a life-changing voyage to modern-day Japan.",3.918287,The Wolverine,6.3,4110.0,6.405343797856049
146216,tt1821694,"Action, Comedy, Crime, Thriller",en,RED 2,Retired C.I.A. agent Frank Moses reunites his unlikely team of elite operatives for a global quest to track down a missing portable nuclear device.,11.04233,RED 2,6.4,1548.0,6.564882043576259
136400,tt1272878,"Action, Comedy, Crime",en,2 Guns,A DEA agent and an undercover Naval Intelligence officer who have been tasked with investigating one another find they have been set up by the mob -- the very organization the two men believe they have been stealing money from.,13.336512,2 Guns,6.6,1611.0,6.679308623853211
160588,tt2334873,"Comedy, Drama",en,Blue Jasmine,"Jasmine French used to be on the top of the heap as a New York socialite, but now is returning to her estranged sister in San Francisco utterly ruined. As Jasmine struggles with her haunting memories of a privileged past bearing dark realities she ignored, she tries to recover in her present. Unfortunately, it all proves a losing battle as Jasmine's narcissistic hangups and their consequences begin to overwhelm her. In doing so, her old pretensions and new deceits begin to foul up everyone's lives, especially her own.",12.61244,Blue Jasmine,7.0,1126.0,6.897551785714286
76285,tt1854564,"Adventure, Family, Fantasy",en,Percy Jackson: Sea of Monsters,"In their quest to confront the ultimate evil, Percy and his friends battle swarms of mythical creatures to find the mythical Golden Fleece and to stop an ancient evil from rising.",10.338222,Percy Jackson: Sea of Monsters,5.9,1685.0,6.255811361200428
138832,tt1723121,"Comedy, Crime",en,We're the Millers,A veteran pot dealer creates a fake family as part of his plan to move a huge shipment of weed into the U.S. from Mexico.,18.474368,We're the Millers,6.8,3053.0,6.7983959683225335
109418,tt2191701,Comedy,en,Grown Ups 2,"The all-star comedy cast from Grown Ups returns (with some exciting new additions) for more summertime laughs. Lenny (Adam Sandler) has relocated his family back to the small town where he and his friends grew up. This time around, the grown ups are the ones learning lessons from their kids on a day notoriously full of surprises: the last day of school.",9.411725,Grown Ups 2,5.8,1180.0,6.28270095902354
59859,tt1650554,"Action, Adventure, Crime",en,Kick-Ass 2,"After Kick-Ass’ insane bravery inspires a new wave of self-made masked crusaders, he joins a patrol led by the Colonel Stars and Stripes. When these amateur superheroes are hunted down by Red Mist — reborn as The Mother Fucker — only the blade-wielding Hit-Girl can prevent their annihilation.",13.570264,Kick-Ass 2,6.3,2275.0,6.46238300383594
87421,tt1411250,"Science Fiction, Action, Thriller",en,Riddick,"Betrayed by his own kind and left for dead on a desolate planet, Riddick fights for survival against alien predators and becomes more powerful and dangerous than ever before. Soon bounty hunters from throughout the galaxy descend on Riddick only to find themselves pawns in his greater scheme for revenge. With his enemies right where he wants them, Riddick unleashes a vicious attack of vengeance before returning to his home planet of Furya to save it from destruction.",9.596377,Riddick,6.2,2066.0,6.4080867924528295
115782,tt2357129,"Drama, History",en,Jobs,The story of Steve Jobs' ascension from college dropout into one of the most revered creative entrepreneurs of the 20th century.,14.294019,Jobs,6.0,1183.0,6.385074444928167
123553,tt1538403,"Action, Adventure, Drama, Mystery, Romance, Fantasy",en,The Mortal Instruments: City of Bones,"In New York City, Clary Fray, a seemingly ordinary teenager, learns that she is descended from a line of Shadowhunters — half-angel warriors who protect humanity from evil forces. After her mother disappears, Clary joins forces with a group of Shadowhunters and enters Downworld, an alternate realm filled with demons, vampires, and a host of other creatures. Clary and her companions must find and protect an ancient cup that holds the key to her mother's future.",14.336187,The Mortal Instruments: City of Bones,6.2,1649.0,6.439491856677525
132363,tt1327773,Drama,en,The Butler,"A look at the life of Cecil Gaines who served eight presidents as the White House's head butler from 1952 to 1986, and had a unique front-row seat as political and racial history was made.",11.061894,The Butler,7.2,1134.0,6.998806049822064
122906,tt2194499,"Comedy, Drama, Science Fiction",en,About Time,"The night after another unsatisfactory New Year party, Tim's father tells his son that the men in his family have always had the ability to travel through time. Tim can't change history, but he can change what happens and has happened in his own life – so he decides to make his world a better place... by getting a girlfriend. Sadly, that turns out not to be as easy as he thinks.",11.213913,About Time,7.8,2140.0,7.45559803318992
49047,tt1454468,"Science Fiction, Thriller, Drama",en,Gravity,"Dr. Ryan Stone, a brilliant medical engineer on her first Shuttle mission, with veteran astronaut Matt Kowalsky in command of his last flight before retiring. But on a seemingly routine spacewalk, disaster strikes. The Shuttle is destroyed, leaving Stone and Kowalsky completely alone-tethered to nothing but each other and spiraling out into the blackness of space. The deafening silence tells them they have lost any link to Earth and any chance for rescue. As fear turns to panic, every gulp of air eats away at what little oxygen is left. But the only way home may be to go further out into the terrifying expanse of space.",18.50194,Gravity,7.3,5879.0,7.219393107393107
146233,tt1392214,"Drama, Thriller, Crime",en,Prisoners,"When Keller Dover's daughter and her friend go missing, he takes matters into his own hands as the police pursue multiple leads and the pressure mounts. But just how far will this desperate father go to protect his family?",11.96262,Prisoners,7.9,3183.0,7.613268792180592
91586,tt2226417,"Horror, Thriller",en,Insidious: Chapter 2,The haunted Lambert family seeks to uncover the mysterious childhood secret that has left them dangerously connected to the spirit world.,9.040324,Insidious: Chapter 2,6.5,1237.0,6.639309230114845
96721,tt1979320,"Drama, Action",en,Rush,A biographical drama centered on the rivalry between Formula 1 drivers James Hunt and Niki Lauda during the 1976 Formula One motor-racing season.,10.63552,Rush,7.7,2310.0,7.405232476635515
138697,tt2229499,"Romance, Comedy, Drama",en,Don Jon,"A New Jersey guy dedicated to his family, friends, and church, develops unrealistic expectations from watching porn and works to find happiness and intimacy with his potential true love.",10.948605,Don Jon,5.9,1708.0,6.252911410347271
152584,tt2278871,"Romance, Drama",fr,La vie d'Adèle - Chapitres 1 et 2,"Adele's life is changed when she meets Emma, a young woman with blue hair, who will allow her to discover desire, to assert herself as a woman and as an adult. In front of others, Adele grows, seeks herself, loses herself, finds herself.",4.938148,Blue Is the Warmest Color,7.2,1114.0,6.997
109424,tt1535109,"Action, Drama, Thriller",en,Captain Phillips,"The true story of Captain Richard Phillips and the 2009 hijacking by Somali pirates of the US-flagged MV Maersk Alabama, the first American cargo ship to be hijacked in two hundred years.",13.776068,Captain Phillips,7.6,2495.0,7.351209753394293
107846,tt1211956,"Action, Thriller",en,Escape Plan,"Ray Breslin is the world's foremost authority on structural security. After analyzing every high security prison and learning a vast array of survival skills so he can design escape-proof prisons, his skills are put to the test. He's framed and incarcerated in a master prison he designed himself. He needs to escape and find the person who put him behind bars.",14.191611,Escape Plan,6.7,1688.0,6.737371877230549
133805,tt1939659,"Drama, Horror",en,Carrie,"A reimagining of the classic horror tale about Carrie White, a shy girl outcast by her peers and sheltered by her deeply religious mother, who unleashes telekinetic terror on her small town after being pushed too far at her senior prom.",18.399055,Carrie,5.8,1505.0,6.222801069110347
76203,tt2024544,"Drama, History",en,12 Years a Slave,"In the pre-Civil War United States, Solomon Northup, a free black man from upstate New York, is abducted and sold into slavery. Facing cruelty as well as unexpected kindnesses Solomon struggles not only to stay alive, but to retain his dignity. In the twelfth year of his unforgettable odyssey, Solomon’s chance meeting with a Canadian abolitionist will forever alter his life.",30.316249,12 Years a Slave,7.9,3787.0,7.648605590695777
80274,tt1731141,"Science Fiction, Action, Adventure",en,Ender's Game,"Based on the classic novel by Orson Scott Card, Ender's Game is the story of the Earth's most gifted children training to defend their homeplanet in the space wars of the future.",12.500305,Ender's Game,6.6,2354.0,6.662317185697809
76338,tt1981115,"Action, Adventure, Fantasy",en,Thor: The Dark World,"Thor fights to restore order across the cosmos… but an ancient race led by the vengeful Malekith returns to plunge the universe back into darkness. Faced with an enemy that even Odin and Asgard cannot withstand, Thor must embark on his most perilous and personal journey yet, one that will reunite him with Jane Foster and force him to sacrifice everything to save us all.",34.905447,Thor: The Dark World,6.8,4873.0,6.798883581092366
152532,tt0790636,"Drama, History",en,Dallas Buyers Club,"Loosely based on the true-life tale of Ron Woodroof, a drug-taking, women-loving, homophobic man who in 1986 was diagnosed with HIV/AIDS and given thirty days to live.",14.785719,Dallas Buyers Club,7.9,2973.0,7.598535845363347
203833,tt0816442,Drama,en,The Book Thief,"While subjected to the horrors of WWII Germany, young Liesel finds solace by stealing books and sharing them with others. Under the stairs in her home, a Jewish refuge is being sheltered by her adoptive parents.",16.373622,The Book Thief,7.4,1528.0,7.144479939439818
101299,tt1951264,"Adventure, Action, Science Fiction",en,The Hunger Games: Catching Fire,"Katniss Everdeen has returned home safe after winning the 74th Annual Hunger Games along with fellow tribute Peeta Mellark. Winning means that they must turn around and leave their family and close friends, embarking on a ""Victor's Tour"" of the districts. Along the way Katniss senses that a rebellion is simmering, but the Capitol is still very much in control as President Snow prepares the 75th Annual Hunger Games (The Quarter Quell) - a competition that could change Panem forever.",25.309139,The Hunger Games: Catching Fire,7.4,6656.0,7.313116602316603
57158,tt1170358,"Adventure, Fantasy",en,The Hobbit: The Desolation of Smaug,"The Dwarves, Bilbo and Gandalf have successfully escaped the Misty Mountains, and Bilbo has gained the One Ring. They all continue their journey to get their gold back from the Dragon, Smaug.",20.644776,The Hobbit: The Desolation of Smaug,7.6,4633.0,7.44376474682443
64686,tt1335975,"Drama, Action, Adventure, Fantasy",en,47 Ronin,"Based on the original 1941 movie from Japan, and from ancient Japan’s most enduring tale, the epic 3D fantasy-adventure 47 Ronin is born.  Keanu Reeves leads the cast as Kai, an outcast who joins Oishi (Hiroyuki Sanada), the leader of the 47 outcast samurai.  Together they seek vengeance upon the treacherous overlord who killed their master and banished their kind.  To restore honor to their homeland, the warriors embark upon a quest that challenges them with a series of trials that would destroy ordinary warriors.",14.88937,47 Ronin,5.9,1357.0,6.303041683528935
109445,tt2294629,"Animation, Adventure, Family",en,Frozen,"Young princess Anna of Arendelle dreams about finding true love at her sister Elsa’s coronation. Fate takes her on a dangerous journey in an attempt to end the eternal winter that has fallen over the kingdom. She's accompanied by ice delivery man Kristoff, his reindeer Sven, and snowman Olaf. On an adventure where she will find out what friendship, courage, family, and true love really means.",24.248243,Frozen,7.3,5440.0,7.2139938968568815
106646,tt0993846,"Crime, Drama, Comedy",en,The Wolf of Wall Street,"A New York stockbroker refuses to cooperate in a large securities fraud case involving corruption on Wall Street, corporate banking world and mob infiltration. Based on Jordan Belfort's autobiography.",16.382422,The Wolf of Wall Street,7.9,6768.0,7.743683836589698
168672,tt1800241,"Drama, Crime",en,American Hustle,"A con man, Irving Rosenfeld, along with his seductive partner Sydney Prosser, is forced to work for a wild FBI agent, Richie DiMaso, who pushes them into a world of Jersey powerbrokers and mafia.",16.478036,American Hustle,6.8,2868.0,6.798321446509291
116745,tt0359950,"Adventure, Comedy, Drama, Fantasy",en,The Secret Life of Walter Mitty,A timid magazine photo manager who lives life vicariously through daydreams embarks on a true-life adventure when a negative goes missing.,8.684892,The Secret Life of Walter Mitty,7.0,3213.0,6.946964640628611
152601,tt1798709,"Romance, Science Fiction, Drama",en,Her,"In the not so distant future, Theodore, a lonely writer purchases a newly developed operating system designed to meet the user's every needs. To Theordore's surprise, a romantic relationship develops between him and his operating system. This unconventional love story blends science fiction and romance in a sweet tale that explores the nature of love and the ways that technology isolates and connects us all.",13.829515,Her,7.9,4215.0,7.668796397072621
193756,tt1091191,"Action, Drama, Thriller, War",en,Lone Survivor,"Based on the failed June 28, 2005 mission ""Operation Red Wing."" Four members of SEAL Team 10, were tasked with the mission to capture or kill notorious Taliban leader, Ahmad Shah. Only one member of the team survived.",10.855502,Lone Survivor,7.4,1549.0,7.146494930529478
140823,tt2140373,"Comedy, Drama, History",en,Saving Mr. Banks,Author P.L. Travers travels from London to Hollywood as Walt Disney Pictures adapts her novel Mary Poppins for the big screen.,15.130888,Saving Mr. Banks,7.3,1256.0,7.062158649789029
110415,tt1706620,"Action, Science Fiction, Drama",ko,Snowpiercer,"In a future where a failed global-warming experiment kills off most life on the planet, a class system evolves aboard the Snowpiercer, a train that travels around the globe via a perpetual-motion engine.",14.131906,Snowpiercer,6.7,2910.0,6.726022862823062
137094,tt1205537,"Action, Drama, Thriller",en,Jack Ryan: Shadow Recruit,"Jack Ryan, as a young covert CIA analyst, uncovers a Russian plot to crash the U.S. economy with a terrorist attack.",11.234862,Jack Ryan: Shadow Recruit,5.9,1194.0,6.3315060658578854
157350,tt1840309,"Adventure, Action, Science Fiction",en,Divergent,"In a world divided into factions based on personality types, Tris learns that she's been classified as Divergent and won't fit in. When she discovers a plot to destroy Divergents, Tris and the mysterious Four must find out what makes Divergents dangerous before it's too late.",21.572585,Divergent,6.9,4784.0,6.879978975924042
181886,tt2316411,"Thriller, Mystery",en,Enemy,A mild-mannered college professor discovers a look-alike actor and delves into the other man's private affairs.,12.66992,Enemy,6.7,1326.0,6.742916393442623
152760,tt2177771,"War, Drama, History, Action",en,The Monuments Men,"Based on the true story of the greatest treasure hunt in history, The Monuments Men is an action drama focusing on seven over-the-hill, out-of-shape museum directors, artists, architects, curators, and art historians who went to the front lines of WWII to rescue the world’s artistic masterpieces from Nazi thieves and return them to their rightful owners.  With the art hidden behind enemy lines, how could these guys hope to succeed?",11.132411,The Monuments Men,5.8,1545.0,6.216440767205716
137106,tt1490017,"Adventure, Animation, Comedy, Family, Fantasy",en,The Lego Movie,"An ordinary Lego mini-figure, mistakenly thought to be the extraordinary MasterBuilder, is recruited to join a quest to stop an evil Lego tyrant from gluing the universe together.",16.418133,The Lego Movie,7.5,3127.0,7.314552228248055
97020,tt1234721,"Action, Science Fiction",en,RoboCop,"In RoboCop, the year is 2028 and multinational conglomerate OmniCorp is at the center of robot technology.  Overseas, their drones have been used by the military for years, but have been forbidden for law enforcement in America.  Now OmniCorp wants to bring their controversial technology to the home front, and they see a golden opportunity to do it.  When Alex Murphy – a loving husband, father and good cop doing his best to stem the tide of crime and corruption in Detroit – is critically injured, OmniCorp sees their chance to build a part-man, part-robot police officer.  OmniCorp envisions a RoboCop in every city and even more billions for their shareholders, but they never counted on one thing: there is still a man inside the machine.",10.246549,RoboCop,5.7,2385.0,6.048304086881966
120467,tt2278388,"Comedy, Drama",en,The Grand Budapest Hotel,"The Grand Budapest Hotel tells of a legendary concierge at a famous European hotel between the wars and his friendship with a young employee who becomes his trusted protégé. The story involves the theft and recovery of a priceless Renaissance painting, the battle for an enormous family fortune and the slow and then sudden upheavals that transformed Europe during the first half of the 20th century.",14.442048,The Grand Budapest Hotel,8.0,4644.0,7.766675234456409
157336,tt0816692,"Adventure, Drama, Science Fiction",en,Interstellar,Interstellar chronicles the adventures of a group of explorers who make use of a newly discovered wormhole to surpass the limitations on human space travel and conquer the vast distances involved in an interstellar voyage.,32.213481,Interstellar,8.1,11187.0,7.981726363710267
